Physical,Horizon,BOOK,2018,6,46,Duel to the death / J.A. Jance.,"Jance, Judith A.","Reynolds Ali Fictitious character Fiction, Women private investigators Arizona Fiction, Bitcoin Fiction, Electronic funds transfers Fiction, Artificial intelligence Fiction, Arizona Fiction, Thrillers Fiction, Detective and mystery fiction","Touchstone,",2018.
Physical,Horizon,BOOK,2018,6,2,The life we bury / Allen Eskens.,"Eskens, Allen, 1963-","Large type books, Detective and mystery fiction","Wheeler Publishing,",2016.
Digital,OverDrive,AUDIOBOOK,2018,6,1,¿Tu mamá es una llama? (Unabridged),Deborah Guarino,Juvenile Fiction,Scholastic Inc. Audiobooks,2012
Physical,Horizon,SOUNDDISC,2018,6,1,Guidance / Russian Circles.,Russian Circles (Musical group),"Rock music 2011 2020, Rock music","Sargent House,",[2016]
Physical,Horizon,BOOK,2018,6,3,The fallen / Ace Atkins.,"Atkins, Ace","United States Army Commando troops Fiction, Retired military personnel United States Fiction, Bank robberies Fiction, Sheriffs Fiction, Thrillers Fiction, Detective and mystery fiction","G.P. Putnam's Sons, an imprint of Penguin Random House LLC,",[2017]
Digital,OverDrive,EBOOK,2018,6,1,"The Coliseum Con: Geronimo Stilton Graphic Novels Series, Book 3",Geronimo Stilton,"Comic and Graphic Books, Juvenile Fiction",Macmillan Publishers,2015
Physical,Horizon,BOOK,2018,6,2,The Civil War : a narrative. Fort Sumter to Perryville / by Shelby Foote.,"Foote, Shelby",United States History Civil War 1861 1865,"Vintage Books, a division of Random House,",1986.
Physical,Horizon,BOOK,2018,6,1,"The good, the bad, and the furry : life with the world's most melancholy cat / Tom Cox.","Cox, Tom, 1975-","Cats England Norfolk Anecdotes, Cat owners, Human animal relationships","Thomas Dunne Books/St. Martin's Press,",2015.
Digital,OverDrive,EBOOK,2018,6,1,"After the Horses: Dan Sharp Mystery Series, Book 4",Jeffrey Round,"Fiction, Literature, Mystery",Dundurn Press,2016
Digital,OverDrive,EBOOK,2018,6,3,My Lustful Adventures: A Nocturnal Meeting,Ramrod,"Erotic Literature, Fiction",Duke Classics,2018
Physical,Horizon,BOOK,2018,6,2,Lighthousekeeping / Jeanette Winterson.,"Winterson, Jeanette, 1959-","Lighthouse keepers Fiction, Storytelling Fiction, Young women Fiction, Older men Fiction, Clergy Fiction, Blind Fiction, Psychological fiction, Love stories","Harcourt,",[2006]
Digital,OverDrive,EBOOK,2018,6,26,"Measure What Matters: How Google, Bono, and the Gates Foundation Rock the World with OKRs",John Doerr,"Business, Nonfiction","Penguin Group (USA), Inc.",2018
Physical,Horizon,VIDEODISC,2018,6,3,"Kama Sutra : a tale of love / NDF International Ltd., Pony Canyon Inc., Pandora Film in association with Channel Four Films ; a Mirabai Films production ; written by Helena Kriel & Mira Nair ; produced by Lydia Dean Pilcher ; produced and directed by Mira Nair.",,"Courtesans Drama, Love Drama, Feature films, Erotic films, Fiction films, Video recordings for the hearing impaired","Trimark Home Video,",[1997]
Physical,Horizon,BOOK,2018,6,4,The knowledge / Martha Grimes.,"Grimes, Martha","Jury Richard Fictitious character Fiction, Police England Fiction, Murder Investigation Fiction, Large type books, Detective and mystery fiction","Thorndike Press,",2018.
Digital,OverDrive,AUDIOBOOK,2018,6,1,Talking Leaves (Unabridged),Joseph Bruchac,"Historical Fiction, Juvenile Fiction, Juvenile Literature",Books on Tape,2016
Physical,Horizon,BOOK,2018,6,1,Martin Heidegger : between good and evil / Rüdiger Safranski ; translated by Ewald Osers.,"Safranski, Rüdiger","Heidegger Martin 1889 1976, Philosophers Germany Biography","Harvard University Press,",1998.
Physical,Horizon,BOOK,2018,6,1,Motherland / Amy Sohn.,"Sohn, Amy, 1973-","Marriage Fiction, Parenting Fiction, Couples Fiction, Domestic fiction","Simon & Schuster,",2012.
Digital,OverDrive,EBOOK,2018,6,1,A Newport Christmas Wedding: A Novella,Shelley Noble,"Fiction, Literature, Romance",HarperCollins Publishers Inc.,2014
Digital,OverDrive,EBOOK,2018,6,3,"The Crow Girl: Victoria Bergman Series, Book 1",Erik Axl Sund,"Fiction, Mystery, Suspense, Thriller","Random House, Inc.",2016
Physical,Horizon,BOOK,2018,6,1,"All about China : stories, songs, crafts and more for kids / Allison ""Ai Xin"" Branscombe ; Illustrated by Lin Wang.","Branscombe, Allison","Handicraft China Juvenile literature, China Juvenile literature","Tuttle Publishing,",[2014]
Physical,Horizon,BOOK,2018,6,1,The escape / Mary Balogh.,"Balogh, Mary","Widows England Fiction, Widowers England Fiction, Courtship England Fiction, Large type books, Love stories, Regency fiction","Thorndike Press, A part of Gale, Cengage Learning, Gale Cengage Learning,",2014.
Physical,Horizon,SOUNDDISC,2018,6,1,"A cosmic rhythm with each stroke / Vijay Iyer, Wadada Leo Smith.","Iyer, Vijay","Jazz 2011 2020, Trumpet music Jazz, Piano music Jazz","ECM,",[2016]
Digital,OverDrive,EBOOK,2018,6,1,人性的弱点 (How to Win Friends and Influence People),[英]戴尔·卡耐基,"Nonfiction, Psychology",Cloudary Corporation,2013
Physical,Horizon,VIDEODISC,2018,6,4,Aurangzeb / Yash Raj Films ; written & directed by Atul Sabharwal ; produced by Aditya Chopra.,,"Police corruption Drama, Brothers India Drama, Twins India Drama, Good and evil Drama, Gangsters Drama, India Politics and government Drama, Feature films, Action and adventure films, Fiction films, Motion pictures Hindi","Yash Raj Films,",[2013]
Digital,OverDrive,EBOOK,2018,6,3,Twilight Sparkle and the Crystal Heart Spell,Gillian Berrow,"Juvenile Fiction, Juvenile Literature","Hachette Digital, Inc.",2015
Digital,OverDrive,EBOOK,2018,6,1,"Lady Friday: The Keys to the Kingdom Series, Book 5",Garth Nix,"Fantasy, Juvenile Fiction","Scholastic, Inc. (US)",2014
Physical,Horizon,BOOK,2018,6,1,The Jefferson key : a novel / Steve Berry.,"Berry, Steve, 1955-","Malone Cotton Fictitious character Fiction, Cryptologic fiction, Suspense fiction","Ballantine Books,",[2011]
Digital,OverDrive,EBOOK,2018,6,38,Tribe of Mentors: Short Life Advice from the Best in the World,Timothy Ferriss,"Business, Nonfiction",Houghton Mifflin Harcourt Trade and Reference,2017
Physical,Horizon,VIDEODISC,2018,6,16,Marseille trilogy / Marcel Pagnol.,,"Man woman relationships France Drama, Triangles Interpersonal relations France Drama, Love Drama, Unmarried mothers France Drama, Marseille France Drama, Feature films, Fiction films, Motion pictures French","The Criterion Collection,",[2017]
Physical,Horizon,BOOK,2018,6,1,The rebounders : a Division I basketball journey / Amanda Ottaway.,"Ottaway, Amanda,","Ottaway Amanda, Davidson College Basketball, Davidson Wildcats Basketball team, Women basketball players United States Biography, Women college athletes United States Social conditions","University of Nebraska Press,",[2018]
Physical,Horizon,BOOK,2018,6,1,You have seen their faces / by Erskine Caldwell and Margaret Bourke-White ; foreword by Alan Trachtenberg.,"Caldwell, Erskine, 1903-1987","Sharecroppers Southern States, Farm tenancy Economic aspects Southern States, Sharecropping, Cotton growing Southern States, Sharecroppers Southern States Pictorial works, Southern States Social conditions","University of Georgia Press,",1995.
Physical,Horizon,BOOK,2018,6,6,Splendiferous Christmas / written by Jane O'Connor ; illustrated by Robin Preiss Glasser.,"O'Connor, Jane","Fancy Nancy Fictitious character Juvenile fiction, Christmas tree ornaments Juvenile fiction, Christmas Fiction, Family life Fiction, Vocabulary Juvenile fiction","HarperCollins,",[2009]
Physical,Horizon,BOOK,2018,6,1,Under the Empyrean sky / Chuck Wendig.,"Wendig, Chuck","Dystopias Juvenile fiction, Government Resistance to Juvenile fiction, Teenage boys Juvenile fiction, End of the world Fiction, Dystopias Fiction, Government Resistance to Fiction, Teenage boys Fiction","Skyscape/Amazon Publishing,",2013.
Physical,Horizon,BOOK,2018,6,1,Thankfulness : a gratitude attitude! / by Liz George.,"George, Liz","Gratitude Juvenile literature, Conduct of life Juvenile literature","Children's Press, an imprint of Scholastic Inc.,",[2016]
Physical,Horizon,BOOK,2018,6,1,Documents that changed the way we live / Joseph Janes.,"Janes, Joseph","Civilization Western Sources Anecdotes, United States Civilization Sources Anecdotes","Rowman & Littlefield,",c2017.
Physical,Horizon,SOUNDDISC,2018,6,1,The fish that ate the whale : [the life and times of America's banana king] / Rich Cohen.,"Cohen, Rich","Zemurray Samuel 1877 1961, United Fruit Company Biography, Jewish businesspeople Louisiana New Orleans Biography, Banana trade Louisiana New Orleans History","Dreamscape Media,",[2012]
Physical,Horizon,VIDEODISC,2018,6,1,"The Jetsons. Season 2, volume 2 / Hanna-Barbera.",,"Families Juvenile drama, Space colonies Juvenile drama, Space vehicles Juvenile drama, Space flight Juvenile drama, Technology and civilization Juvenile drama, Implements utensils etc Juvenile drama, Television series, Fiction television programs, Science fiction television programs, Television comedies, Animated television programs, Childrens television programs","Warner Home Video,",2011.
Digital,OverDrive,AUDIOBOOK,2018,6,1,The Bone Thief (Unabridged),Alyson Noel,"Juvenile Fiction, Juvenile Literature, Mystery",Books on Tape,2017
Digital,OverDrive,AUDIOBOOK,2018,6,1,Small Plates: Short Fiction (unabridged) (Unabridged),Katherine Hall Page,"Fiction, Mystery, Short Stories, Suspense","Dreamscape Media, LLC",2014
Physical,Horizon,BOOK,2018,6,11,The 48 laws of power / Robert Greene.,"Greene, Robert","Power Philosophy, Control Psychology","Penguin Books,",2000.
Physical,Horizon,BOOK,2018,6,1,All the living / C. E. Morgan.,"Morgan, C. E., 1976-","Unmarried couples Fiction, Tobacco farms Fiction, Large type books, Kentucky History 20th century Fiction","Thorndike Press,",2009.
Physical,Horizon,SOUNDDISC,2018,6,1,Lamentate / Arvo Pärt.,"Pärt, Arvo","Piano with orchestra, Laments, Sacred vocal quintets Unaccompanied","ECM Records,",[2005]
Physical,Horizon,BOOK,2018,6,3,"South America / written by Stephan Kueffner, Tony Perrottet, and Natalie Minnis.","Kueffner, Stephan,","South America Guidebooks, South America Description and travel","APA Publications,",2018.
Physical,Horizon,BOOK,2018,6,5,"I love you, nose! I love you, toes! / Linda Davick.","Davick, Linda","Human body Juvenile fiction, Stories in rhyme Juvenile fiction","Beach Lane Books,",[2013]
Digital,OverDrive,AUDIOBOOK,2018,6,1,Lock and Key (Unabridged),Sarah Dessen,Young Adult Fiction,Books on Tape,2008
Digital,OverDrive,EBOOK,2018,6,4,They Come in All Colors: A Novel,Malcolm Hansen,"Fiction, Literature","Simon & Schuster, Inc.",2018
Digital,OverDrive,EBOOK,2018,6,1,"Plague World: Ashley Parker Series, Book 3",Dana Fredsti,"Fantasy, Fiction","Random House, Inc.",2014
Physical,Horizon,BOOK,2018,6,2,"Guardians of the Galaxy. [2], Angela / writer, Brian Michael Bendis ; consultant, Neil Gaiman ; artists, Sara Pichelli (#4-7) with Olivier Coipel & Mark Morales and Valerio Schiti ; art & color, Francesco Francavilla (#8-9) ; artist, Kevin Maguire (#10) ; colorists, Justin Ponsor (#4-7, #10) with Ive Svorcina ; letterer, VC' Cory Petit.","Bendis, Brian Michael","Iron Man Fictitious character Comic books strips etc, Superheroes Comic books strips etc, Extraterrestrial beings Comic books strips etc, Human alien encounters Comic books strips etc, Guardians of the Galaxy Fictitious characters Comic books strips etc, Science fiction comic books strips etc, Graphic novels","Marvel Worldwide,",[2013]
Physical,Horizon,SOUNDDISC,2018,6,1,Cabin fever / by Jeff Kinney.,"Kinney, Jeff","Family life Fiction, Fear Juvenile fiction, Blizzards Juvenile fiction, Middle schools Juvenile fiction, Schools Fiction, Diaries Fiction, Humorous fiction","Recorded Books ; repackaged [and distributed] by Midwest Tape,",[2011]
Digital,OverDrive,AUDIOBOOK,2018,6,3,How to Write Short: Word Craft for Fast Times (unabridged) (Unabridged),Roy Peter Clark,"Education, Nonfiction, Reference",Gildan Media Corp,2015
Physical,Horizon,SOUNDDISC,2018,6,2,Creation's journey : Native American music / presented by the National Museum of the American Indian.,,"Indians of North America Music, Aymara Indians Bolivia Music, Zapotec Indians Music","Smithsonian/Folkways,",[1994]
Physical,Horizon,SOUNDDISC,2018,6,4,Skippyjon Jones in mummy trouble / by Judy Schachner.,"Schachner, Judith Byron","Jones Skippyjon Fictitious character Juvenile fiction, Siamese cat Juvenile fiction, Cats Juvenile fiction, Chihuahua Dog breed Juvenile fiction, Dogs Fiction, Mummies Juvenile fiction","Puffin Storytime,",[2006]
Digital,OverDrive,EBOOK,2018,6,2,Napoleon's Hemorrhoids: And Other Small Events That Changed History,Phil Mason,"History, Nonfiction, Reference",Lightning Source Inc,2014
Physical,Horizon,BOOK,2018,6,1,"In like a lion, out like a lamb / by Marion Dane Bauer ; illustrated by Emily Arnold McCully.","Bauer, Marion Dane","Stories in rhyme Juvenile fiction, March Month Juvenile fiction, Spring Juvenile fiction","Holiday House,",2011.
Physical,Horizon,VIDEODISC,2018,6,9,The great alone / FilmRise ; Reel as Dirt & Hock Films ; an Arctic Film Camp production ; produced by Jonathan Hock ; directed by Greg Kohs.,,"Mackey Lance, Yukon Quest International Sled Dog Race, Iditarod Race, Sled dog racing Alaska, Mushers Alaska Biography, Cancer Patients, Feature films, Documentary films, Sports films, Biographical films, Nonfiction films","FilmRise,",[2016]
Physical,Horizon,MUSIC,2018,6,1,"Women composers of ragtime : a collection of six selected rags by women composers, reprinted from the original sheet music / compiled and introduced by Carolynn A. Lindeman.",,Piano music Ragtime,"T. Presser,",[1985]
Digital,OverDrive,AUDIOBOOK,2018,6,2,Locomotive (Unabridged),Brian Floca,"History, Juvenile Nonfiction, Transportation","Dreamscape Media, LLC",2014
Digital,OverDrive,EBOOK,2018,6,3,"A Month of Summer: Blue Sky Hills Series, Book 1",Lisa Wingate,"Fiction, Literature","Penguin Group (USA), Inc.",2011
Physical,Horizon,BOOK,2018,6,1,The Roman Empire / Philip Steele.,"Steele, Philip, 1948-","Rome Italy History Juvenile literature, Rome Italy Civilization Juvenile literature","Rosen Central,",2009.
Physical,Horizon,BOOK,2018,6,1,Duplicate effort / Kristine Kathryn Rusch.,"Rusch, Kristine Kathryn","Forensic anthropologists Fiction, Human cloning Fiction, Murder Investigation Fiction, Science fiction, Mystery fiction","WMG Publishing,",2012.
Physical,Horizon,BOOK,2018,6,3,Sharks have six senses / John F. Waters ; illustrated by Bob Barner.,"Waters, John F., 1930-2012,","Sharks Sense organs Juvenile literature, Sharks Juvenile literature, Senses and sensation Juvenile literature","Harper, an imprint of HarperCollins Publishers,",[2015]
Digital,OverDrive,EBOOK,2018,6,1,I Will Never Leave You: How Couples Can Achieve The Power Of Lasting Love,Hugh Prather,"Family & Relationships, Nonfiction, Self-Improvement","Random House, Inc.",2009
Physical,Horizon,BOOK,2018,6,1,Manchester United : the biggest and the best / [text by Illugi Jökulsson].,Illugi Jökulsson,Manchester United Soccer team History Juvenile literature,"Abbeville Press Publishers,",2014.
Physical,Horizon,BOOK,2018,6,1,"Tangsin i piti ramyŏn / Paek Ka-hŭi, chiŭm.","Paek, Ka-hŭi,","Korean poetry, Korean essays, Love, Poetry, Essays","Tosŏ Ch'ulp'an K'ung,",2017.
Physical,Horizon,BOOK,2018,6,1,Showdown at Shepherd's Bush : the 1908 Olympic marathon and the three runners who launched a sporting craze / David Davis.,"Davis, David, 1962-","Pietri Dorando 1885 1942, Longboat Tom 1887 1949, Hayes Johnny 1886 1965, Olympic Games 4th 1908 London England, Marathon running History, Olympics History, Long distance runners","Thomas Dunne Books,",2012.
Physical,Horizon,VIDEODISC,2018,6,3,"Les maudits = The damned / Gaumont ; production Spéva Films ; [presented by] André Paulvé, Michel Safra ; adaptation de René Clément et Jacques Rémy ; d'apres un scénario de Jacques Companéez et Victor Alexandrov ; dialogues de Henri Jeanson ; un film de René Clément.",,"Nazis Drama, Escapes Drama, Kidnapping Drama, Feature films, Motion pictures French, Action and adventure films, Thrillers Motion pictures, Fiction films","Cohen Media Group : Distributed by Entertainment One,",[2013]
Physical,Horizon,BOOK,2018,6,4,Wildflowers / Libby Romero.,"Romero, Libby",Wild flowers North America Identification Juvenile literature,"National Geographic,",[2018]
Digital,OverDrive,AUDIOBOOK,2018,6,1,Best of the West: Classic Stories from the American Frontier: Volume 2 (unabridged) (Unabridged),Arte Johnson,"Fiction, Western","Phoenix Books, Inc.",2009
Physical,Horizon,VIDEODISC,2018,6,4,"Cancer : the emperor of all maladies / written by Geoffrey Ward, Ken Burns, Barak Goodman, David Blistein ; directed by Barak Goodman, Jack Youngelson, Deborah Dickson, Chris Durrance ; a production of Florentine Films, Laura Ziskin Pictures and WETA, Washington, D.C. in association with Ark Media.",,"Cancer History, Leukemia History, Documentary films, Nonfiction films, Video recordings for the hearing impaired, Video recordings for people with visual disabilities","Distributed by PBS Distribution,",c2015.
Digital,OverDrive,EBOOK,2018,6,3,Charlie Goes to the Doctor: I Can Read Level 1,Ree Drummond,"Beginning Reader, Juvenile Fiction",HarperCollins Publishers Inc.,2015
Physical,Horizon,BOOK,2018,6,11,The dark clouds shining / David Downing.,"Downing, David, 1946-","Intelligence officers Great Britain Fiction, Women journalists Great Britain Fiction, Espionage British Fiction, Thrillers Fiction, Historical fiction, Spy fiction","Soho Crime,",[2018]
Physical,Horizon,SOUNDDISC,2018,6,3,The pursuit / Janet Evanovich & Lee Goldberg.,"Evanovich, Janet","United States Federal Bureau of Investigation Fiction, Fugitives from justice Fiction, Kidnapping Fiction, Audiobooks, Mystery fiction","Books on Tape ; Random House Audio,",[2016]
Digital,OverDrive,AUDIOBOOK,2018,6,1,"Dangerous in Diamonds: Rarest Blooms Series, Book 4 (unabridged) (Unabridged)",Madeline Hunter,"Fiction, Historical Fiction, Literature, Romance","Tantor Media, Inc",2013
Physical,Horizon,BOOK,2018,6,2,Big magic for little hands / Joshua Jay.,"Jay, Joshua","Magic tricks Juvenile literature, Magic","Workman Publishing,",[2014]
Physical,Horizon,BOOK,2018,6,1,Agile selling : getting up to speed quickly in today's ever-changing sales world / Jill Konrath.,"Konrath, Jill",Selling,"Portfolio/Penguin,",c2014.
Physical,Horizon,BOOK,2018,6,3,Let's eat! = ¡A comer! / by Pat Mora ; illustrated by Maribel Suárez.,"Mora, Pat","Families Juvenile fiction, Dinners and dining Juvenile fiction, Hispanic Americans Juvenile fiction, Family life Fiction, Spanish language materials Bilingual","HarperCollins,",©2008.
Physical,Horizon,BOOK,2018,6,1,The everything guide to mortgages : find the perfect loan to finance the home of your dreams / Lisa Holton.,"Holton, Lisa","Mortgages United States, Mortgages Handbooks manuals etc, Mortgage loans United States, House buying United States","Adams Media,",[2008]
Physical,Horizon,BOOK,2018,6,1,The Cherokee rose : a novel of gardens and ghosts / Tiya Miles.,"Miles, Tiya, 1970-","Chief Vann House Spring Place Ga Fiction, Cherokee Indians Georgia History 19th century Fiction, Plantations Georgia Spring Place History 19th century Fiction, Plantation life Georgia Spring Place History 19th century Fiction, Historical fiction","John F. Blair, Publisher,",[2015]
Physical,Horizon,BOOK,2018,6,3,Animal farm : a fairy story / by George Orwell ; preface by Russell Baker ; introduction by C.M. Woodhouse.,"Orwell, George, 1903-1950","Totalitarianism Fiction, Allegories","Signet Classic,",[1996]
Physical,Horizon,VIDEODISC,2018,6,3,"Pokémon heroes : Latios & Latias / Miramax Films ; 4 Kids Productions ; Pikachu Project ; produced by Choji Yoshikawa, Yukako Matsusako, Takemoto Mori ; written by Hideki Sonoda ; directed by Kunihiko Yuyama ; adaptation produced by Kathy Borland ; adaptation written and directed by Jim Malone.",,"Pok‚mon Fictitious characters Juvenile drama, Thieves Juvenile drama, Feature films, Childrens films, Anime, Fiction films, Fantasy films","Echo Bridge Home Entertainment,",[2011]
Physical,Horizon,BOOK,2018,6,4,Waylon! : one awesome thing / Sara Pennypacker ; pictures by Marla Frazee.,"Pennypacker, Sara, 1951-","Genius Juvenile fiction, Brothers and sisters Juvenile fiction, Schools Juvenile fiction, Change Juvenile fiction","Disney-Hyperion,",2016.
Physical,Horizon,BOOK,2018,6,1,Awakening the heroes within : twelve archetypes to help us find ourselves and transform our world / Carol S. Pearson.,"Pearson, Carol, 1944-","Archetype Psychology, Self actualization Psychology","HarperSanFrancisco,",[1991]
Digital,OverDrive,EBOOK,2018,6,1,The Birth of Korean Cool: How One Nation Is Conquering the World Through Pop Culture,Euny Hong,"Biography & Autobiography, History, Nonfiction, Sociology",Macmillan Publishers,2014
Physical,Horizon,BOOK,2018,6,3,Plants feed me / Lizzy Rockwell.,"Rockwell, Lizzy",Plants Edible Juvenile literature,"Holiday House,",[2013]
Physical,Horizon,VIDEODISC,2018,6,3,"Yūkoku = Patriotism, or The rite of love and death / gensaku, kyakushoku, seisaku, kantoku, shuen Mishima Yukio.",,"Japan Kaigun Officers Drama, Suicide Drama, Fiction films, Short films, Silent films, Motion pictures Japanese","Criterion Collection,",[2008]
Digital,OverDrive,EBOOK,2018,6,1,Gilt Trip,Laura Childs,"Fiction, Mystery","Penguin Group (USA), Inc.",2013
Physical,Horizon,BOOK,2018,6,3,"¡Policias, ladrones y cocodrilos! / escrito por Trey King; ilustrado por Kenny Kiernan.","King, Trey","LEGO toys Juvenile fiction, Swamps Juvenile fiction, Contests Juvenile fiction, Thieves Juvenile fiction, Crocodiles Juvenile fiction","Scholastic Inc.,",2016.
Physical,Horizon,BOOK,2018,6,3,A friendly town that's almost always by the ocean! / Kir Fo& M. Shelley Coats ; illustrated by Rachel Sanson.,"Fox, Kir","City and town life Fiction, Middle schools Fiction, Schools Fiction, Supernatural Fiction, Moving Household Fiction, Humorous stories, City and town life Juvenile fiction, Middle schools Juvenile fiction, Schools Juvenile fiction, Moving Household Juvenile fiction","Disney-Hyperion,",2018.
Physical,Horizon,BOOK,2018,6,3,"All the women in my family sing : women write the world--essays on equality, justice, and freedom / edited by Deborah Santana.",,"Minority women Social conditions 21st century Anecdotes, Minority women Anecdotes, Women Black Social conditions 21st century Anecdotes, Women Black Anecdotes, African American women Social conditions 21st century Anecdotes, African American women Anecdotes, Asian American women Social conditions 21st century Anecdotes, Asian American women Anecdotes, Women Social conditions 21st century Anecdotes, Women Anecdotes, Feminism, Womens rights, Essays","Nothing But the Truth, LLC,",2018.
Digital,OverDrive,AUDIOBOOK,2018,6,2,Dissolution: BBC Radio 4 full-cast dramatisation (unabridged) (Unabridged),CJ Sansom,"Fiction, Historical Fiction",Random House Group Limited,2017
Physical,Horizon,BOOK,2018,6,13,"Lost treasure of the Emerald Eye / Geronimo Stilton ; [illustrations by Matt Wolf, Mark Nithael, and Kat Stevens].","Stilton, Geronimo","Mice Juvenile fiction, Animals Fiction, Buried treasure Fiction, Mystery and detective stories, Humorous stories","Scholastic,",2004.
Physical,Horizon,BOOK,2018,6,2,"Sweater girls : 20 patterns for starlet sweaters, retro wraps & glamour knits / Madeline Weston and Rita Taylor ; photography by Debi Treloar.","Weston, Madeline","Knitting Patterns, Sweaters","Taunton Press,",2012.
Digital,OverDrive,EBOOK,2018,6,2,Dear Amy: A Novel,Helen Callaghan,"Fiction, Literature, Suspense, Thriller",HarperCollins Publishers Inc.,2016
Physical,Horizon,BOOK,2018,6,1,Wiener Wolf / Jeff Crosby.,"Crosby, Jeff","Dogs Fiction, Pets Fiction, Wolves Juvenile fiction, Humorous stories","Disney/Hyperion Books,",[2011]
Physical,Horizon,BOOK,2018,6,1,Hidden scars / Mark de Castrique.,"De Castrique, Mark","Cold cases Criminal investigation Fiction, Blackstone Sam Fictitious character Fiction, Black Mountain N C Fiction, North Carolina Fiction, Detective and mystery fiction","Poisoned Pen Press,",2017.
Digital,OverDrive,EBOOK,2018,6,1,Archie's Haunted House,George Gladir,"Comic and Graphic Books, Juvenile Fiction, Juvenile Literature","Random House, Inc.",2015
Physical,Horizon,VIDEODISC,2018,6,11,"Raw / Focus World ; Wild Bunch ; a Petit Film, Rogue International and Frakkas Productions coproduction ; with the participation of Canal+ and Cine+, Centre National du Cinema et de l'Image Animee, Tax Shelter of the Belgian Federal Government, Casa Kafka Pictures, Belfius ; a RTBF, VOO and BE TV coproduction ; with the participation of Arte/Cofinova ; Ezekiel Film Production ; Wild Bunch ; produit par Jean des Forêts, Julie Gayet & Nadia Turincev ; un film de Julia Ducournau.",,"Teenage girls Drama, Vegetarians Drama, Hazing Drama, Feature films, Horror films, Coming of age films, Fiction films, Motion pictures French, Video recordings for the hearing impaired","Universal Pictures Home Entertainment,",[2017]
Digital,OverDrive,EBOOK,2018,6,1,Titanic: Voices from the Disaster,Deborah Hopkinson,"History, Juvenile Nonfiction","Scholastic, Inc. (US)",2014
Physical,Horizon,BOOK,2018,6,2,The golem and the jinni : a novel / Helene Wecker.,"Wecker, Helene","Golem Fiction, Jinn Fiction, Friendship Fiction, Rabbis Fiction, Jewish mythology Fiction, Mythology Arab Fiction, New York N Y History 19th century Fiction, Fantasy fiction, Historical fiction","Harper,",©2013.
Digital,OverDrive,AUDIOBOOK,2018,6,3,"Ramona and Her Father: Ramona Quimby Series, Book 4 (unabridged) (Unabridged)",Beverly Cleary,"Juvenile Fiction, Juvenile Literature",HarperCollins Publishers Inc.,2014
Physical,Horizon,SOUNDDISC,2018,6,3,The blue room / Madeleine Peyroux.,"Peyroux, Madeleine","Jazz vocals, Jazz 2011 2020, Popular music 2011 2020","Universal/Decca,",[2012]
