Digital,OverDrive,EBOOK,2018,6,1,Maisy's Field Day,Lucy Cousins,"Juvenile Fiction, Juvenile Literature, Picture Book Fiction",Candlewick Press,2017
Digital,OverDrive,EBOOK,2018,6,1,"The Double Wedding Ring: Someday Quilts Mystery Series, Book 5",Clare O'Donohue,"Fiction, Mystery","Penguin Group (USA), Inc.",2013
Physical,Horizon,BOOK,2018,6,1,"The Upright Citizens Brigade comedy improvisation manual / Matt Besser, Ian Roberts and Matt Walsh.","Besser, Matt, 1967-","Comedy Technique, Improvisation Acting Technique, Comedy sketches Technique","Comedy Council of Nicea, LLC,",2013.
Digital,OverDrive,AUDIOBOOK,2018,6,3,"The Killing Dance: Anita Blake, Vampire Hunter Series, Book 6 (unabridged) (Unabridged)",Laurell K. Hamilton,"Fantasy, Fiction, Romance",Books on Tape,2010
Physical,Horizon,BOOK,2018,6,2,Noni is nervous / Heather Hartt-Sussman ; illustrated by Geneviève Côté.,"Hartt-Sussman, Heather","First day of school Juvenile fiction, Schools Fiction, Anxiety Juvenile fiction","Tundra Books,",[2013]
Physical,Horizon,BOOK,2018,6,3,A dark so deadly / Stuart MacBride.,"MacBride, Stuart","Police Scotland Fiction, Murder Investigation Fiction, Scotland Fiction, Mystery fiction, Detective and mystery fiction","HarperCollins,",2017.
Physical,Horizon,BOOK,2018,6,1,General Crook and the western frontier / by Charles M. Robinson III.,"Robinson, Charles M., 1949-","Crook George 1829 1890, Indians of North America Wars 1866 1895, Generals United States Biography","University of Oklahoma Press,",[2001]
Physical,Horizon,BOOK,2018,6,1,Sitting Bull : great Sioux hero / George E. Stanley.,"Stanley, George Edward","Sitting Bull 1831 1890 Juvenile literature, Dakota Indians Biography Juvenile literature, Hunkpapa Indians Biography Juvenile literature, Little Bighorn Battle of the Mont 1876 Juvenile literature, Dakota Indians Juvenile literature, Hunkpapa Indians Juvenile literature","Sterling,",2010.
Digital,OverDrive,EBOOK,2018,6,3,More Than This,Patrick Ness,"Science Fiction & Fantasy, Young Adult Fiction, Young Adult Literature",Candlewick Press,2013
Digital,OverDrive,EBOOK,2018,6,5,Kevin Hearne's The Iron Druid Chronicles 3-Book Bundle: Hounded; Hexed; Hammered,Kevin Hearne,"Fantasy, Fiction, Thriller","Random House, Inc.",2012
Digital,OverDrive,EBOOK,2018,6,2,The Ionian Mission (Volume Book 8)  (Aubrey/Maturin Novels),Patrick O'Brian,"Fantasy, Fiction",W. W. Norton & Company,2015
Physical,Horizon,VIDEODISC,2018,6,2,"Karen llora en un bus = Karen cries on the bus / Cajanegra Producciones ; Schweizen ; Viva TV ; en asocio con Ciclope Films, Producciones El Paso ; con el apoyo del Fondo Para el Desarrollo Cinematografico Colombia ; producida por Alejandro Prieto ; una pelicula escrita y dirigida por Gabriel Rojas Vera.",,"Female friendship Drama, Self realization Drama, Janitors Drama, Colombia Drama, Feature films, Fiction films, Motion pictures Spanish, Video recordings for the hearing impaired","Film Movement,",2011.
Digital,OverDrive,EBOOK,2018,6,1,The Vegetables We Eat,Gail Gibbons,"Juvenile Nonfiction, Picture Book Nonfiction, Science",Holiday House,2015
Physical,Horizon,BOOK,2018,6,10,The alchemyst : the secrets of the immortal Nicholas Flamel / Michael Scott.,"Scott, Michael, 1959-","Flamel Nicolas 1418 Juvenile fiction, Dee John 1527 1608 Juvenile fiction, Alchemists Juvenile fiction, Magic Juvenile fiction, Brothers and sisters Juvenile fiction, Twins Juvenile fiction, San Francisco Calif Juvenile fiction, Occult fiction, Paranormal fiction","Delacorte Press,",[2007]
Digital,OverDrive,AUDIOBOOK,2018,6,2,Children of Jihad: A Young American's Travels among the Youth of the Middle East (unabridged) (Unabridged),Jared Cohen,"Biography & Autobiography, Nonfiction, Sociology, Travel","Blackstone Audio, Inc.",2007
Physical,Horizon,BOOK,2018,6,1,The river knows / Amanda Quick.,"Quick, Amanda","Women booksellers Fiction, Antiquarian booksellers England London Fiction, Suicide Fiction, London England Fiction, Historical fiction, Romantic suspense fiction","G.P. Putnam's Sons,",[2007]
Physical,Horizon,BOOK,2018,6,1,DRRR!!. Volume 1 / Ryohgo Narita ; illustration by Suzuhito Yasuda ; [translation by Stephen Paul].,"Narita, Ryōgo, 1980-","City and town life Japan Tokyo Fiction, Demonology Fiction, High school students Japan Tokyo Fiction, Motorcyclists Fiction, Ikebukuro Tokyo Japan Fiction, Young adult fiction, Romance fiction","Yen On : Hachette Book Group,",2015.
Digital,OverDrive,EBOOK,2018,6,1,The Exhaustion Breakthrough: Unmask the Hidden Reasons You're Tired and Beat Fatigue for Good,Holly Phillips,"Health & Fitness, Nonfiction","Random House, Inc.",2015
Physical,Horizon,BOOK,2018,6,1,Romantic violence : memoirs of an American skinhead / Christian Picciolini ; foreward by Joan Jett.,"Picciolini, Christian","Picciolini Christian Childhood and youth, Skinheads United States Biography, Neo Nazis United States Biography, Ex gang members United States Biography, White supremacy movements United States, Blue Island Ill Biography","Goldmill Group,",[2015]
Physical,Horizon,BOOK,2018,6,1,"Super manga matrix / Hiroyoshi Tsukamoto ; [editing, Jun Ito ; translation and copy editing, Alma Reyes ; translation, Kayoko Kimata].","Tsukamoto, Hiroyoshi","Comic books strips etc Japan Technique, Comic strip characters Japan Technique, Cartooning Technique, Cartoon characters Japan, Drawing Technique","Harper Design,",2012.
Digital,OverDrive,EBOOK,2018,6,1,A Hero of Our Time,Mikhail Lermontov,"Fiction, Literature","Penguin Group (USA), Inc.",2013
Physical,Horizon,BOOK,2018,6,9,Life in the garden / Penelope Lively.,"Lively, Penelope, 1933-","Lively Penelope 1933, Lively Penelope 1933 Knowledge Gardening, Novelists English 20th century Biography, Gardens in literature","Viking,",[2018]
Physical,Horizon,BOOK,2018,6,1,The madonnas of Leningrad / Debra Dean.,"Dean, Debra, 1957-","Gosudarstvennyi Ermitazh Russia Fiction, Art treasures in war Fiction, Reminiscing in old age Fiction, Memory Fiction, Russian Americans Fiction, Older women Fiction, Saint Petersburg Russia History Siege 1941 1944 Fiction","Harper Perennial,",2007.
Physical,Horizon,BOOK,2018,6,5,Minecraft construction handbook / written by Matthew Needler and Phil Southam (FyreUK) ; illustrations by James Barker and Theo Cordner.,"Needler, Matthew","Minecraft Game Handbooks manuals etc Juvenile literature, Video games Handbooks manuals etc Juvenile literature","Scholastic,",[2014]
Physical,Horizon,SOUNDDISC,2018,6,1,Adventure / Shonen Knife.,Shonen Knife (Musical group),"Rock music 2011 2020, Rock music Japan 2011 2020","Good Charamel Records,",[2016]
Digital,OverDrive,EBOOK,2018,6,7,"The Cutting Edge: Lincoln Rhyme Series, Book 14",Jeffery Deaver,"Fiction, Mystery, Thriller","Hachette Digital, Inc.",2018
Physical,Horizon,BOOK,2018,6,11,The Whole30 day by day : your daily guide to Whole30 success / Melissa Hartwig.,"Hartwig, Melissa","Diet therapy Popular works, Nutrition Popular works, Food habits Popular works, Self care Health Popular works, Weight loss Popular works","Houghton Mifflin Harcourt,",[2017]
Physical,Horizon,BOOK,2018,6,1,"Pedro, the angel of Olvera Street / by Leo Politi.","Politi, Leo, 1908-1996","Christmas Fiction, Posadas Social custom Juvenile fiction, Mexican Americans Juvenile fiction, Los Angeles Calif Juvenile fiction","Getty Publications,",[2009]
Physical,Horizon,VIDEODISC,2018,6,2,Learn to play the drumset : a professionals unique approach to playing the drumset / by Peter Magadini ; produced and directed by Peter Magadini.,"Magadini, Pete","Drum set Methods Self instruction, Drum set Instruction and study, Instructional films","Hal Leonard Corp.,",[2003]
Physical,Horizon,BOOK,2018,6,1,The Dalai Lama.,"Thomas, Lowell, 1923-",Bstan dzin rgya mtsho Dalai Lama XIV 1935,"Duell, Sloan and Pearce,",[1961]
Physical,Horizon,BOOK,2018,6,9,The Enchantress returns / Chris Colfer ; illustrated by Brandon Dorman.,"Colfer, Chris, 1990-","Fairy tales, Characters in literature Fiction, Twins Juvenile fiction, Fantasy, Characters and characteristics in literature Juvenile fiction, Magic Juvenile fiction, Brothers and sisters Juvenile fiction, Fairy tales","Little, Brown and Company,",2013.
Digital,OverDrive,AUDIOBOOK,2018,6,4,A Girl's Guide to Moving On: A Novel (unabridged) (Unabridged),Debbie Macomber,"Fiction, Literature, Romance",Books on Tape,2016
Physical,Horizon,VIDEODISC,2018,6,3,Major crimes. The complete second season / Warner Bros. Television.,,"Los Angeles Calif Police Department Drama, Criminal investigation California Los Angeles Drama, Criminal investigation Drama, Police California Los Angeles Drama, Police Drama, Detective and mystery television programs, Fiction television programs, Television series, Video recordings for the hearing impaired","Warner Home Video,",[2014]
Digital,OverDrive,EBOOK,2018,6,1,"The Perfect Play: Play By Play Series, Book 1",Jaci Burton,"Erotic Literature, Fiction, Romance","Penguin Group (USA), Inc.",2011
Digital,OverDrive,EBOOK,2018,6,2,Soul Currency: Investing Your Inner Wealth for Fulfillment and Abundance,Ernest D. Chu,"Business, Nonfiction, Self-Improvement",New World Library,2012
Physical,Horizon,BOOK,2018,6,1,"You can't always get what you want : my life with the Rolling Stones, the Grateful Dead and other wonderful reprobates / Sam Cutler.","Cutler, Sam","Cutler Sam, Rolling Stones History, Concert agents Biography, Music trade","ECW Press,",2009.
Digital,OverDrive,EBOOK,2018,6,1,The Secret Knowledge of Water: There Are Two Easy Ways to Die in the Desert: Thirst and Drowning,Craig Childs,"Nature, Nonfiction","Hachette Digital, Inc.",2009
Physical,Horizon,BOOK,2018,6,1,Close to om : stretching yoga from your mat to your life / Andrea Marcum.,"Marcum, Andrea","Yoga, Hatha yoga","St. Martin's Griffin,",[2018]
Physical,Horizon,BOOK,2018,6,1,"Grunts : inside the American infantry combat experience, World War II through Iraq / John C. McManus.","McManus, John C., 1965-","United States Army Infantry History 20th century, United States Army Infantry History 21st century, United States Marine Corps History 20th century, United States Marine Corps History 21st century, Combat History 20th century, Combat History 21st century","New American Library,",[2010]
Physical,Horizon,BOOK,2018,6,1,"A year without ""made in China"" : one family's true life adventure in the global economy / Sara Bongiorni.","Bongiorni, Sara, 1964-","Boycotts United States Case studies, Consumers United States Attitudes, Exports China, Globalization Economic aspects United States","John Wiley & Sons, Inc.,",[2007]
Digital,OverDrive,AUDIOBOOK,2018,6,1,Practicing History: Selected Essays (unabridged) (Unabridged),Barbara W. Tuchman,"History, Nonfiction","Blackstone Audio, Inc.",2009
Digital,OverDrive,AUDIOBOOK,2018,6,2,"The Sorcerer's Daughter: Defenders of Shannara Series, Book 3 (unabridged) (Unabridged)",Terry Brooks,"Fantasy, Fiction, Science Fiction, Thriller",Books on Tape,2016
Physical,Horizon,BOOK,2018,6,1,The Zapatistas' dignified rage : final public speeches of Subcommander Marcos / edited by Nick Henck ; translated by Henry Gales ; with additional contributions by Lt. Col. Moisés and Commander Hortensia.,,"Marcos subcomandante Oratory, Ej‚rcito Zapatista de Liberaci¢n Nacional Mexico, Guerrillas Mexico Chiapas, Revolutionaries Mexico Chiapas, Chiapas Mexico History Peasant Uprising 1994","AK Press,",[2018]
Digital,OverDrive,EBOOK,2018,6,2,"The Seducer: The Seducer Series, Book 1",Madeline Hunter,"Fiction, Historical Fiction, Romance","Random House, Inc.",2009
Digital,OverDrive,AUDIOBOOK,2018,6,4,Peace Is Every Breath: A Practice for Our Busy Lives (unabridged) (Unabridged),Thich Nhat Hanh,"Nonfiction, Religion & Spirituality",HarperCollins Publishers Inc.,2011
Physical,Horizon,BOOK,2018,6,1,Loser : the real Seattle music story / by Clark Humphrey.,"Humphrey, Clark","Rock music Washington State Seattle History and criticism, Rock groups Washington State Seattle Biography","MISCmedia,",[2016]
Digital,OverDrive,EBOOK,2018,6,1,Hidden Cities: My Journey into the Secret World of Urban Exploration,Moses Gates,"Nonfiction, Travel","Penguin Group (USA), Inc.",2013
Physical,Horizon,BOOK,2018,6,4,The rain dragon rescue / by Suzanne Selfors ; illustrations by Dan Santat.,"Selfors, Suzanne","Dragons Juvenile fiction, Imaginary creatures Fiction, Veterinarians Juvenile fiction, Apprentices Juvenile fiction, Animals Mythical Juvenile fiction","Little, Brown and Company,",2014.
Physical,Horizon,BOOK,2018,6,1,Living abroad. Australia / Ulrike Lemmin-Woolfrey.,"Lemmin-Woolfrey, Ulrike","Cross cultural orientation Australia, Business etiquette Australia, Visitors Foreign Australia Handbooks manuals etc, Employment in foreign countries Handbooks manuals etc, Americans Australia Handbooks manuals etc, Americans Australia Life skills guides, Americans Employment Australia, Australia Social life and customs, Australia Guidebooks","Avalon Travel,",2017.
Digital,OverDrive,EBOOK,2018,6,3,Girl Meets God: On the Path to a Spiritual Life,Lauren F. Winner,"Biography & Autobiography, Nonfiction, Religion & Spirituality",Open Road Integrated Media,2012
Physical,Horizon,VIDEODISC,2018,6,2,"Morrer como um homem = To die like a man / Strand Releasing ; Rosa Filmes e Ad Vitam ; realização, João Pedro Rodrigues ; argumento, João Pedro Rodrigues, Rui Catalão ; colaboração, João Rui Guerra da Mata ; produtora, Maria João Sigalho.",,"Female impersonators Drama, Transsexuals Drama, Sexual minorities Drama, Gay couples Drama, Sex change Drama, Gay men Drama, May December romances Drama, Comedy films, Fantasy films, Fiction films, Feature films","Strand Releasing,",[2011]
Physical,Horizon,BOOK,2018,6,10,The Valentine baby mystery / David A. Adler ; illustrated by Susanna Natti.,"Adler, David A.","Jansen Cam Fictitious character Juvenile fiction, Photographic memory Juvenile fiction, Physicians Juvenile fiction, Lost articles Juvenile fiction, Mystery and detective stories, Detective and mystery fiction","Puffin Books,",2011.
Physical,Horizon,BOOK,2018,6,1,The bookwoman's last fling : a Cliff Janeway novel / John Dunning.,"Dunning, John, 1942-","Janeway Cliff Fictitious character Fiction, Booksellers and bookselling Fiction, Antiquarian booksellers Fiction, Ex police officers Fiction, Horse trainers Crimes against Fiction, Book collectors Fiction, Idaho Fiction, Mystery fiction","Scribner,",[2006]
Physical,Horizon,SOUNDDISC,2018,6,1,In rolling waves / the Naked and Famous.,Naked and Famous (Musical group),"Popular music 2011 2020, Electronic dance music, Popular music, Electronic dance music","Republic Records,",[2013]
Digital,OverDrive,EBOOK,2018,6,1,Making History,Stephen Fry,"Fiction, Historical Fiction, Humor (Fiction), Science Fiction","Random House, Inc.",2014
Physical,Horizon,BOOK,2018,6,1,Tennis in action / John Crossingham ; illustrations by Bonna Rouse.,"Crossingham, John, 1974-",Tennis Juvenile literature,"Crabtree Pub.,",[2002]
Physical,Horizon,BOOK,2018,6,1,Robert B. Parker's Kickback / Ace Atkins.,"Atkins, Ace","Spenser Fictitious character Fiction, Private investigators Massachusetts Boston Fiction, Sentences Criminal procedure Massachusetts Fiction, Judicial corruption Massachusetts Fiction, Corporations Corrupt practices Fiction, Corrections Contracting out Fiction, Large type books, Mystery fiction","Thorndike Press Large Print,",2015.
Digital,OverDrive,AUDIOBOOK,2018,6,2,"NYPD Red 4: NYPD Red Series, Book 4 (unabridged) (Unabridged)",James Patterson,"Fiction, Suspense, Thriller","Blackstone Audio, Inc.",2016
Physical,Horizon,BOOK,2018,6,1,The ambassador's wife : a novel / Jennifer Steil.,"Steil, Jennifer","Americans Middle East Fiction, Ambassadors Fiction, Artists Fiction, Kidnapping Fiction, Middle East Fiction, Suspense fiction","Doubleday,",[2015]
Digital,OverDrive,EBOOK,2018,6,2,The Miami Mediterranean Diet: Lose Weight and Lower Your Risk of Heart Disease,Michael Ozner,"Cooking & Food, Health & Fitness, Nonfiction",Lightning Source Inc,2009
Physical,Horizon,SOUNDDISC,2018,6,3,"Live 1975 / Bob Dylan, the Rolling Thunder Revue.","Dylan, Bob, 1941-","Rock music 1971 1980, Popular music 1971 1980","Columbia/Legacy,",[2002]
Physical,Horizon,BOOK,2018,6,2,Home at last / Lily Everett.,"Everett, Lily","Bars Drinking establishments Fiction, Courtship Fiction, Romance fiction","St. Martin's Paperbacks,",2017.
Digital,OverDrive,EBOOK,2018,6,1,"War of the Werelords: Wereworld Series, Book 6",Curtis Jobling,"Fantasy, Young Adult Fiction","Penguin Group (USA), Inc.",2013
Physical,Horizon,BOOK,2018,6,1,Everlost / Neal Shusterman.,"Shusterman, Neal","Spirit possession Juvenile fiction, Traffic accidents Juvenile fiction, Death Juvenile fiction, Future life Juvenile fiction, Soul Fiction, Teenagers Fiction, Supernatural Fiction, Fantasy fiction, Young adult fiction","Simon & Schuster BFYR,",2009.
Physical,Horizon,BOOK,2018,6,1,Ink flamingos / Karen E. Olson..,"Olson, Karen E.","Women tattoo artists Fiction, Murder Nevada Las Vegas Fiction, Las Vegas Nev Fiction, Mystery fiction","Obsidian,",2011.
Physical,Horizon,VIDEODISC,2018,6,4,"Beck. 1, episodes 1-3 / produced by Victoria Film in collaboration with Filmlance International, Frankfurter Filmproduktion, TV4/Sweden, TV2/Denmark, TV2/Norway, Canal+ and with support from Nordic Film & Television Fund & Eurimages ; story & screenplay, Rolf Börjlind ; producers, Lars Blomgren & Thomas Lydholm.",,"Beck Martin Fictitious character Drama, Criminal investigation Sweden Stockholm Drama, Detective and mystery television programs, Television cop shows, Fiction television programs, Television series","Distributed by MHZ Networks Home Entertainment,",[2012]
Digital,OverDrive,EBOOK,2018,6,3,"Rules to Catch a Devilish Duke: Scandalous Brides Series, Book 3",Suzanne Enoch,"Fiction, Historical Fiction, Romance",Macmillan Publishers,2013
Digital,OverDrive,EBOOK,2018,6,2,The Undertaker's Widow: A Novel,Phillip Margolin,"Fiction, Literature, Suspense, Thriller","Random House, Inc.",2012
Physical,Horizon,VIDEODISC,2018,6,2,"Rescue me. Season five, volume two / Sony Pictures Television.",,"New York N Y Fire Department Drama, Fire fighters New York State New York Drama, Fire extinction Drama, Imaginary conversations Drama, Fire fighters Job stress New York State New York Drama, Television comedies, Fiction television programs, Video recordings for the hearing impaired, Television series","Sony Pictures Home Entertainment,",[2009]
Digital,OverDrive,EBOOK,2018,6,2,Misspent Youth,Peter F. Hamilton,"Fiction, Science Fiction","Random House, Inc.",2012
Digital,OverDrive,EBOOK,2018,6,2,Today I'll Be a Unicorn,Dana Simpson,"Juvenile Fiction, Juvenile Literature","Andrews McMeel Publishing, LLC",2018
Physical,Horizon,BOOK,2018,6,3,Little bug / by Lynn Maslen Kertell ; pictures by Sue Hendra.,"Kertell, Lynn Maslen.","Reading Primary Whole word method Juvenile literature, Phonetics Study and teaching Primary Juvenile literature, Vocabulary Juvenile literature, Insects Juvenile fiction","Scholastic,",[2010]
Digital,OverDrive,AUDIOBOOK,2018,6,3,"Reclaim Your Brain: How to Calm Your Thoughts, Heal Your Mind, and Bring Your Life Back Under Control (unabridged) (Unabridged)",Joseph A. Annibali,"Nonfiction, Psychology",Books on Tape,2015
Physical,Horizon,BOOK,2018,6,2,"The wall and the gate : Israel, Palestine, and the legal battle for human rights / Michael Sfard ; translated by Maya Johnston.","Sefarad, Mikhaʾel","Palestinian Arabs Civil rights West Bank, Palestinian Arabs Civil rights Gaza Strip, Human rights West Bank, Human rights Gaza Strip, Law and geography West Bank, Law and geography Gaza Strip","Metropolitan Books, Henry Holt and Company,",2018.
Physical,Horizon,BOOK,2018,6,1,Heads up money / written by Marcus Weeks ; consultant Derek Braddon.,"Weeks, Marcus","Economics Juvenile literature, Finance Juvenile literature","DK Publishing,",2016.
Digital,OverDrive,EBOOK,2018,6,1,Do I Have to Give Up Me to Be Loved by You,Jordan Paul,"Family & Relationships, Nonfiction, Self-Improvement","Simon & Schuster, Inc.",2010
Physical,Horizon,VIDEODISC,2018,6,1,"Haendŭp'on = Handphone / chejak, Cinetory, Hank'ŏm ; kongdong chejak, Fine Works ; SK Telecom ; chejak, Hur Tae-ku, Chung Hae-young ; kamdok/kaksaek, Kim Han-min; kakpon, Kim Mi-hyŏn.",,"Theatrical agents Drama, Thrillers Motion pictures, Fiction films, Feature films, Motion pictures Korean","Asian Crush,",[2014?]
Physical,Horizon,BOOK,2018,6,16,Ramona the pest / Beverly Cleary ; illustrated by Jacqueline Rogers.,"Cleary, Beverly","Quimby Ramona Fictitious character Juvenile fiction, Kindergarten Juvenile fiction, Schools Juvenile fiction","Harper,",2013.
Digital,OverDrive,EBOOK,2018,6,3,"The Darkest Torment: Lords of the Underworld Series, Book 12",Gena Showalter,"Fantasy, Fiction, Romance","Harlequin Enterprises, Ltd.",2016
Digital,OverDrive,EBOOK,2018,6,2,"Forbidden: Medieval Series, Book 2",Elizabeth Lowell,"Fiction, Historical Fiction, Romance",HarperCollins Publishers Inc.,2008
Digital,OverDrive,EBOOK,2018,6,1,"Phylogenesis: The Founding of the Commonwealth Series, Book 1",Alan Dean Foster,"Fiction, Science Fiction, Thriller","Random House, Inc.",2010
Physical,Horizon,BOOK,2018,6,4,Stop being lonely : three simple steps to developing close friendships and deep relationships / Kira Asatryan.,"Asatryan, Kira, 1984-","Friendship, Interpersonal relations, Loneliness","New World Library,",[2016]
Physical,Horizon,BOOK,2018,6,1,The crime of complicity : the bystander in the Holocaust / Amos N. Guiora.,"Guiora, Amos N., 1957-","Holocaust Jewish 1939 1945 Moral and ethical aspects, Bystander effect Europe History 20th century, Accomplices Europe History 20th century","Ankerwycke : American Bar Association,",[2017]
Physical,Horizon,BOOK,2018,6,1,"The dark tower. Battle of Jericho Hill / [creative director and executive director, Stephen King ; plotting and consultation, Robin Furth ; script, Peter David ; art, Jae Lee & Richard Isanove ; lettering, Chris Eliopoulos with Rus Wooton].","David, Peter (Peter Allen)","Roland Fictitious character King Comic books strips etc, Imaginary wars and battles Comic books strips etc, Good and evil Comic books strips etc, Comic books strips etc, Fantasy comics, Graphic novels","Marvel Enterprises,",[2010]
Physical,Horizon,BOOK,2018,6,1,What we find / Robyn Carr.,"Carr, Robyn","Neurosurgeons Fiction, Fathers and daughters Fiction, Man woman relationships Fiction, Large type books, Love stories","Wheeler Publishing Large Print,",2016.
Digital,OverDrive,EBOOK,2018,6,1,Strength for Life: The Fitness Plan for the Rest of Your Life,Shawn Phillips,"Health & Fitness, Nonfiction","Random House, Inc.",2008
Physical,Horizon,BOOK,2018,6,7,The echo maker / Richard Powers.,"Powers, Richard, 1957-","Capgras syndrome Fiction, Neurologists Fiction, Nebraska Fiction, Psychological fiction, Medical fiction","Picador/Farrar, Straus and Giroux,","2007, ©2006."
Digital,OverDrive,EBOOK,2018,6,1,"Snakeskin Shamisen: Mas Arai Series, Book 3",Naomi Hirahara,"Fiction, Mystery, Suspense, Thriller","Random House, Inc.",2013
Physical,Horizon,BOOK,2018,6,2,The fifth elephant / Terry Pratchett.,"Pratchett, Terry","Vimes Samuel Fictitious character Fiction, Discworld Imaginary place Fiction, Assassination Fiction, Theft Fiction, Fantasy fiction, Humorous fiction","Harper,",2014.
Digital,OverDrive,EBOOK,2018,6,1,The End of an Error,Mameve Medwed,"Fiction, Literature",HarperCollins Publishers Inc.,2008
Digital,OverDrive,EBOOK,2018,6,1,"Ghost Star Night: Sea of Stars Series, Book 1",Nicole Kimberling,"Fantasy, Fiction, Romance","Samhain Publishing, Ltd.",2013
Physical,Horizon,SOUNDDISC,2018,6,3,The deer's cry / music by Arvo Pärt.,"Pärt, Arvo","Choruses Sacred Mixed voices Unaccompanied, Choruses Sacred Mens voices with instrumental ensemble, Choruses Sacred Mixed voices 4 parts with organ, Psalms Music 133rd Psalm, Sacred vocal quartets, Sacred music, Art music, Psalms Music","ECM Records,",[2016]
Physical,Horizon,VIDEODISC,2018,6,6,"Dheepan / Sundance Selects ; Wild Bunch ; une coproduction Why Not Productions, Page 114, France 2 Cinema ; avec la participation de Canal+, Cine+, France Televisions ; en association avec Cinemage 9, A Plus Image 5, Palatine Etoile 12, Indefilms 3, La Banque Postale Image 8, Cofinova 11, SofiTVcine 2, Soficinema 11 ; scénario, Noé Debré, Thomas Bidegain, Jacques Audiard ; un film de Jacques Audiard.",,"Sri Lankans France Paris Drama, Refugees Drama, Immigrant families France Paris Drama, Criminal behavior France Drama, Feature films, Fiction films","The Criterion Collection,",[2017]
Physical,Horizon,BOOK,2018,6,4,City of thieves : a novel / David Benioff.,"Benioff, David","Grandparent and child Fiction, Reminiscing in old age Fiction, Russians United States Fiction, Survival Fiction, Wilderness survival Fiction, Saint Petersburg Russia History Siege 1941 1944, Historical fiction, Domestic fiction","Plume,",[2009]
Physical,Horizon,SOUNDDISC,2018,6,1,Jesus and the Gospels / Luke Timothy Johnson.,"Johnson, Luke Timothy","Jesus Christ Biography, Jesus Christ Historicity, Jesus Christ History of doctrines, Bible Gospels Criticism interpretation etc","Teaching Co.,",[2004]
Digital,OverDrive,AUDIOBOOK,2018,6,2,"On My Knees: Stark International Series, Book 2 (unabridged) (Unabridged)",J. Kenner,"Erotic Literature, Fiction, Romance",Books on Tape,2015
Physical,Horizon,BOOK,2018,6,1,"Sixty : a diary of my sixty-first year : the beginning of the end, or the end of the beginning? / Ian Brown.","Brown, Ian, 1954-","Brown Ian 1954 Diaries, Brown Ian 1954 Travel, Middle aged persons Canada Diaries, Middle aged men Canada Diaries, Authors Canadian Diaries, Journalists Canada Diaries, Aging Psychological aspects, Birthdays Psychological aspects, Aging Social aspects","The Experiment,",2016.
